0,1,2
SERANGOON NORTH AVENUE 1, Hougang NPC,1.4903404603848383 km
BELGRAVIA DRIVE, Ang Mo Kio South NPC,1.841331225783823 km
CLUNY PARK ROAD, Bukit Timah NPC,0.3074516436059198 km
EAST COAST AVENUE, Marine Parade NPC,0.8642832888091223 km
CHANCERY HILL ROAD, Kampong Java NPC,1.4289882635032727 km
DYSON ROAD, Toa Payoh NPC,1.469303550565391 km
TAN SIM BOH ROAD, Toa Payoh NPC,1.4827746627162908 km
BEDOK SOUTH AVENUE 3, Bedok North NPC,1.6317747355725047 km
WHAMPOA EAST, Rochor NPC,1.9529555521538122 km
BALMORAL ROAD, Kampong Java NPC,1.8514312363886605 km
LIM AH PIN ROAD, Hougang NPC,1.2579231697540607 km
LORONG K TELOK KURAU, Marine Parade NPC,0.979452486806235 km
UPPER SERANGOON VIEW, Sengkang NPC,2.018166026726967 km
ENG KONG ROAD, Bukit Batok NPC,1.692756222300319 km
ENG KONG TERRACE, Bukit Batok NPC,1.814392812960298 km
LORONG KISMIS, Bukit Batok NPC,1.856798746077418 km
UPPER TOH TUCK TERRACE, Bukit Batok NPC,1.719092851661083 km
FLOWER ROAD, Bukit Merah West NPC,3.516059016842622 km
GROVE DRIVE, Clementi NPC,1.8911104170034772 km
GLASGOW ROAD, Serangoon NPC,1.2825524202252934 km
CLUNY HILL, Bukit Timah NPC,0.7553970953112947 km
SUNSHINE TERRACE, Serangoon NPC,0.7562757134212041 km
VANDA AVENUE, Bukit Timah NPC,1.8189830298149443 km
CORONATION DRIVE, Bukit Timah NPC,0.7945908106851799 km
JALAN MELOR, Geylang NPC,2.2837596195606293 km
JALAN CHENGKEK, Geylang NPC,2.2887596557396352 km
DA SILVA LANE, Hougang NPC,1.1947685364956744 km
GREENDALE RISE, Bukit Timah NPC,1.181051358113291 km
JALAN LEMBAH THOMSON, Bishan NPC,1.6637140700636408 km
STILL LANE, Marine Parade NPC,0.8789854961686039 km
WAN THO AVENUE, Serangoon NPC,2.2197074632144123 km
ONE TREE HILL, Orchard NPC,1.5713334086284252 km
JALAN ARIF, Hougang NPC,0.8997975477629303 km
MARSHALL ROAD, Marine Parade NPC,1.3611898601507166 km
PARKSTONE ROAD, Geylang NPC,1.136700989487671 km
LORONG AH SOO, Serangoon NPC,1.0618282236531842 km
LORONG L TELOK KURAU, Marine Parade NPC,0.8891099016229093 km
HOW SUN DRIVE, Serangoon NPC,1.2561406837685107 km
NIM TERRACE, Ang Mo Kio South NPC,1.6239652043811383 km
NIM RISE, Ang Mo Kio South NPC,1.65136311242395 km
NORMANTON PARK, Queenstown NPC,1.05807123214604 km
JALAN ARNAP, Orchard NPC,1.2405875526455308 km
JALAN KELAWAR, Orchard NPC,1.3158184708393266 km
JALAN LEMPENG, Clementi NPC,0.6388277062322869 km
LORONG 1 REALTY PARK, Hougang NPC,1.1231228848662074 km
HOUGANG AVENUE 7, Serangoon NPC,2.2413638840100996 km
WEST COAST CRESCENT, Clementi NPC,2.173076814841929 km
JALAN REDOP, Hougang NPC,1.9254836644171691 km
JALAN SAYANG, Bedok South NPC,0.5811992340779467 km
RAMBAI ROAD, Marine Parade NPC,1.2065741083575543 km
SPRINGSIDE AVENUE, Yishun South NPC,2.2307178150875213 km
SPRINGSIDE VIEW, Yishun South NPC,1.8379194963351826 km
LORONG PUNTONG, Bishan NPC,2.0156425292287152 km
LORONG N TELOK KURAU, Marine Parade NPC,0.7544654806335378 km
WAK HASSAN DRIVE, Sembawang NPC,2.49021336567523 km
HONG LEE PLACE, Serangoon NPC,0.8610204217062282 km
SUNBIRD AVENUE, Changi NPC,0.7747847669893475 km
SUNBIRD ROAD, Changi NPC,0.8224946375414895 km
JALAN LOYANG BESAR, Pasir Ris NPC,1.2991212280128024 km
YIO CHU KANG DRIVE, Ang Mo Kio North NPC,1.4110345552407142 km
BARKER ROAD, Kampong Java NPC,1.514640833009138 km
JALAN KEMBANGAN, Bedok South NPC,1.5857915755311125 km
BEDOK PLACE, Bedok North NPC,1.2539832043213202 km
JALAN GREJA, Bedok North NPC,2.238645109611821 km
TAMAN BEDOK, Bedok North NPC,2.0499993843537974 km
SIAK KEW AVENUE, Toa Payoh NPC,2.2718383792525354 km
JALAN PERNAMA, Changi NPC,1.9249678958499037 km
BINJAI PARK, Bukit Batok NPC,3.17700200048915 km
BINJAI RISE, Bukit Batok NPC,3.294334089820393 km
SERANGOON AVENUE 3, Hougang NPC,1.4304271491918221 km
DUNSFOLD DRIVE, Serangoon NPC,1.3751202621155427 km
MUSWELL HILL, Serangoon NPC,1.2061657663393737 km
LYNWOOD GROVE, Serangoon NPC,1.217204731658711 km
CLIFTON VALE, Serangoon NPC,1.0133401105496487 km
MACKERROW ROAD, Serangoon NPC,0.9182181359940668 km
COTSWOLD CLOSE, Serangoon NPC,1.0590623584757293 km
MELROSE DRIVE, Serangoon NPC,0.8171892932347058 km
JALAN MAT JAMBOL, Queenstown NPC,1.804747572794603 km
BURGUNDY RISE, Bukit Batok NPC,1.1681873328499903 km
BURGUNDY DRIVE, Bukit Batok NPC,1.2711226215936382 km
JALAN SIMPANG BEDOK, Bedok North NPC,0.9876736290600677 km
GALLOP ROAD, Bukit Timah NPC,1.0695438467413065 km
JALAN ILMU, Bukit Timah NPC,0.9273285515522202 km
DUNEARN CLOSE, Bukit Timah NPC,0.26750841796633656 km
CHEE HOON AVENUE, Bukit Timah NPC,0.49387143051092774 km
JALAN SENI, Bukit Timah NPC,0.7834171238453684 km
JALAN UNGGAS, Bukit Timah NPC,0.6148307952196226 km
JALAN SEJARAH, Bukit Timah NPC,0.8194171455733594 km
JALAN BAHASA, Bukit Timah NPC,0.7290962394002356 km
JALAN ADAT, Bukit Timah NPC,0.87683152869576 km
JALAN ASUHAN, Bukit Timah NPC,0.7840703085470458 km
BRIGHT HILL CRESCENT, Bishan NPC,1.7272259080585664 km
JALAN SINAR BINTANG, Pasir Ris NPC,1.412695142437325 km
MARIAM CLOSE, Pasir Ris NPC,1.3366846543553006 km
LENGKOK MARIAM, Pasir Ris NPC,1.1848692210146736 km
JALAN SINAR BULAN, Pasir Ris NPC,1.3812127268937486 km
JALAN MARIAM, Pasir Ris NPC,1.1187471934378523 km
LA SALLE STREET, Bedok South NPC,0.7789598905058125 km
CHESTNUT GARDENS, Bukit Panjang NPC,2.0042466003349735 km
JALAN EMAS URAI, Bukit Panjang NPC,2.1263198177073592 km
CHUAN GARDEN, Serangoon NPC,1.2761324500162674 km
CHUAN LINK, Serangoon NPC,1.022388023625225 km
CHUAN PLACE, Serangoon NPC,0.9631130990855745 km
CHUAN DRIVE, Serangoon NPC,0.8954947341725077 km
CHUAN VIEW, Serangoon NPC,1.1072118672951372 km
CHWEE CHIAN VIEW, Queenstown NPC,1.914429800827068 km
SUNSET SQUARE, Clementi NPC,0.9589354493115503 km
SUNSET PLACE, Clementi NPC,0.9232004442894411 km
SUNSET TERRACE, Clementi NPC,0.7895532288698492 km
SUNSET WALK, Clementi NPC,0.7828653285992017 km
SUNSET VIEW, Clementi NPC,0.8908009067896568 km
SUNSET CLOSE, Clementi NPC,0.829030894397121 km
SUNSET VALE, Clementi NPC,1.314698483328434 km
HONG SAN WALK, Choa Chu Kang NPC,1.9104027929760878 km
CHOA CHU KANG AVENUE 1, Choa Chu Kang NPC,1.9213603210819492 km
KANG CHOO BIN ROAD, Hougang NPC,0.9850915821677212 km
TANAH MERAH KECHIL AVENUE, Bedok North NPC,0.9449108335889824 km
LEEDON HEIGHTS, Bukit Timah NPC,1.3430738945258407 km
CORONATION ROAD, Bukit Timah NPC,2.599581428943804 km
DUCHESS AVENUE, Bukit Timah NPC,0.6115051636482249 km
DUBLIN ROAD, Orchard NPC,0.08421414258410485 km
TREVOSE CRESCENT, Bukit Timah NPC,0.9441809847692124 km
BERRIMA ROAD, Bukit Timah NPC,1.2077789644821844 km
SWANAGE ROAD, Geylang NPC,0.9795696161015184 km
KHEAM HOCK ROAD, Bukit Timah NPC,0.8163941606599344 km
MERRYN ROAD, Bukit Timah NPC,1.1351968750695822 km
SENNETT LANE, Bedok North NPC,1.684703826386077 km
SENNETT ROAD, Serangoon NPC,2.1447570897290094 km
PASIR PANJANG DRIVE, Clementi NPC,2.81369743214872 km
SENNETT PLACE, Bedok North NPC,1.6192972947880446 km
TUA KONG WALK, Bedok South NPC,0.9904609023846278 km
EASTWOOD GREEN, Bedok North NPC,2.276229915519913 km
EASTWOOD WAY, Changi NPC,2.324067490392963 km
EASTWOOD DRIVE, Bedok North NPC,2.2656020301537216 km
JALAN NOVENA UTARA, Kampong Java NPC,1.3130073040652686 km
JALAN NOVENA TIMOR, Kampong Java NPC,1.3051832197472149 km
JALAN NOVENA SELATAN, Kampong Java NPC,1.2366628104805053 km
JALAN LIM TAI SEE, Bukit Timah NPC,1.8911209441841796 km
EWART PARK, Clementi NPC,2.0772819649626095 km
BEGONIA DRIVE, Ang Mo Kio North NPC,2.1013314220688364 km
FLORENCE CLOSE, Hougang NPC,1.3904964356836167 km
FLORENCE ROAD, Hougang NPC,1.3036047137881979 km
JANSEN ROAD, Serangoon NPC,1.1394848362912182 km
FUDU PARK, Ang Mo Kio North NPC,0.9864492625984476 km
FULTON ROAD, Bishan NPC,1.7054513175243846 km
LENTOR TERRACE, Ang Mo Kio North NPC,0.9040487646387004 km
JALAN UJI, Bukit Batok NPC,1.502857231865245 km
JALAN TUMPU, Bukit Batok NPC,1.5660468392463378 km
JALAN ASAS, Bukit Batok NPC,1.4629878574773834 km
JALAN SIAP, Bukit Batok NPC,1.63135542510936 km
SHAMAH TERRACE, Bukit Batok NPC,0.6827775821215026 km
CONWAY CIRCLE, Serangoon NPC,1.0101571425792921 km
LORONG 28 GEYLANG, Geylang NPC,0.23419862511461623 km
GERALD TERRACE, Hougang NPC,1.7697320289024514 km
LORONG 24 GEYLANG, Geylang NPC,0.352665133380091 km
GERALD DRIVE, Hougang NPC,1.6973062003539394 km
GERALD CRESCENT, Hougang NPC,1.6072671479413687 km
LORONG 32 GEYLANG, Geylang NPC,0.3136001531476492 km
GENTLE ROAD, Kampong Java NPC,0.9942682004090749 km
LI HWAN DRIVE, Serangoon NPC,0.8565851661362704 km
LI HWAN CLOSE, Serangoon NPC,0.7918691465963582 km
LORONG CHUAN, Serangoon NPC,0.6388815332145624 km
LI HWAN TERRACE, Serangoon NPC,0.7309024967153894 km
LI HWAN WALK, Serangoon NPC,0.7920788732003272 km
LI HWAN VIEW, Serangoon NPC,0.6741741489450511 km
MEI HWAN ROAD, Bishan NPC,1.2875933846555867 km
TOH TUCK WALK, Bukit Batok NPC,1.456906202915936 km
KISMIS PLACE, Bukit Batok NPC,1.617637503779308 km
GOODLINK PARK, Yishun South NPC,1.6662881170111632 km
GOODMAN ROAD, Geylang NPC,1.3056382817767456 km
TOH TUCK ROAD, Bukit Batok NPC,1.649869871113445 km
GREENWOOD WALK, Bukit Timah NPC,1.468154491866521 km
GREENWOOD AVENUE, Bukit Timah NPC,1.0579212341629003 km
HAZEL PARK TERRACE, Bukit Panjang NPC,1.902723158758478 km
SERANGOON GARDEN DRIVE, Ang Mo Kio South NPC,1.1194045675042015 km
SERANGOON GARDEN TERRACE, Ang Mo Kio South NPC,1.1149473326639956 km
SERANGOON GARDEN PLACE, Ang Mo Kio South NPC,1.1330347876172118 km
SERANGOON GARDEN RISE, Ang Mo Kio South NPC,1.1087536008053347 km
SERANGOON GARDEN CLOSE, Ang Mo Kio South NPC,1.147586927330139 km
HOLLAND GROVE ROAD, Clementi NPC,1.9750978840343687 km
MOUNT SINAI ROAD, Clementi NPC,1.88113720762968 km
GROVE CRESCENT, Clementi NPC,2.0133627844761652 km
KOON SENG ROAD, Marine Parade NPC,1.4415520964493955 km
GROVE AVENUE, Clementi NPC,2.1298758373015434 km
MOUNT SINAI LANE, Clementi NPC,2.029239667656289 km
HIGHGATE CRESCENT, Bukit Batok NPC,1.3326813762359653 km
FERNVALE ROAD, Sengkang NPC,1.9561173395542444 km
HILLCREST ROAD, Bukit Timah NPC,0.9341392448221232 km
GREENMEAD AVENUE, Bukit Timah NPC,1.1819211769808806 km
PHOENIX ROAD, Bukit Panjang NPC,1.9490535262085675 km
HILLVIEW DRIVE, Bukit Batok NPC,0.6080597609902869 km
HOLLAND GREEN, Clementi NPC,2.125564560846494 km
MOONBEAM WALK, Clementi NPC,1.7174851098658304 km
MOONBEAM DRIVE, Clementi NPC,1.8180349339914672 km
MOONBEAM TERRACE, Clementi NPC,1.7289292512729209 km
MOONBEAM VIEW, Clementi NPC,1.7670771142633441 km
CHUN TIN ROAD, Bukit Batok NPC,2.037056771733415 km
ANG MO KIO AVENUE 2, Bishan NPC,0.749378055320742 km
LORONG PISANG EMAS, Bukit Batok NPC,1.8449642983309944 km
YUK TONG AVENUE, Bukit Batok NPC,1.9889789900762755 km
LORONG PISANG RAJA, Bukit Batok NPC,1.8099206463643753 km
LORONG PISANG BATU, Bukit Batok NPC,1.8930422803452573 km
INGGU ROAD, Sembawang NPC,2.764410900467226 km
KANG CHOO BIN WALK, Hougang NPC,1.0642188580341256 km
JOO CHIAT PLACE, Geylang NPC,1.544310390008464 km
CHUAN HOE AVENUE, Serangoon NPC,1.4284996880827254 km
JALAN TUA KONG, Bedok South NPC,1.3392074410268437 km
OCEAN DRIVE, Marina Bay NPC,2.691666593333936 km
KELULUT HILL, Hougang NPC,1.6423973511476493 km
JALAN KECHUBONG, Hougang NPC,1.7823069439279915 km
LIMAU WALK, Bedok North NPC,1.8476079444846132 km
YARWOOD AVENUE, Clementi NPC,2.97613705130467 km
WILMONAR AVENUE, Clementi NPC,2.9483631044928518 km
KING'S ROAD, Bukit Timah NPC,0.16684457653247597 km
KING'S CLOSE, Bukit Timah NPC,1.1634229726201115 km
JALAN SENYUM, Bedok South NPC,0.6624101820918088 km
LORONG KEMBANGAN, Bedok South NPC,1.4848732660157402 km
TAMAN SELAMAT, Bedok South NPC,0.691763016740136 km
KING'S WALK, Bukit Timah NPC,1.2054463321717859 km
JALAN SELAMAT, Bedok South NPC,0.46540841898385016 km
RECREATION LANE, Serangoon NPC,0.4856226728684392 km
SWISS VIEW, Bukit Batok NPC,3.4513915183912864 km
JALAN LABU AYER, Serangoon NPC,0.9723394541503544 km
BRANKSOME ROAD, Geylang NPC,1.327859402668283 km
SANDILANDS ROAD, Serangoon NPC,1.333616779406409 km
PONGGOL SEVENTEENTH AVENUE, Punggol NPC,2.35564344189775 km
JALAN TELITI, Hougang NPC,1.5912148036132834 km
JALAN LAPANG, Bedok South NPC,0.15300931383974306 km
MAYFIELD AVENUE, Geylang NPC,1.631071171601807 km
PAYA LEBAR STREET, Serangoon NPC,2.1533006726457673 km
CHIAP GUAN AVENUE, Serangoon NPC,1.0617964909454582 km
DUKU ROAD, Marine Parade NPC,1.2332037131228486 km
JALAN TANAH PUTEH, Bedok South NPC,1.4755048160968303 km
CHARLTON ROAD, Serangoon NPC,1.161946280155228 km
LANGE ROAD, Serangoon NPC,0.8979914229482859 km
SIMON PLACE, Hougang NPC,1.186525693230697 km
HOLLAND GROVE WALK, Clementi NPC,1.6795447642891326 km
CHU LIN ROAD, Bukit Batok NPC,0.9862807014954882 km
LORONG LEW LIAN, Serangoon NPC,0.5733981458784798 km
PENAGA PLACE, Sembawang NPC,2.6976402674952222 km
CARPMAEL ROAD, Geylang NPC,1.3207647183250435 km
QUEEN'S ROAD, Bukit Timah NPC,0.8696294267408627 km
CRANE ROAD, Geylang NPC,1.5176112593152724 km
BEDOK WALK, Bedok North NPC,1.2219974480010634 km
TEMBELING ROAD, Geylang NPC,1.6278918859481686 km
BUNGA RAMPAI PLACE, Serangoon NPC,1.992181051978086 km
UPPER CHANGI ROAD EAST, Changi NPC,1.2526448567016566 km
LORONG GAMBIR, Serangoon NPC,0.9706900299394529 km
SECOND AVENUE, Bukit Timah NPC,1.6402892813661651 km
LORONG H TELOK KURAU, Marine Parade NPC,1.1434482822180414 km
PHILLIPS AVENUE, Serangoon NPC,1.390130670249842 km
JALAN MINGGU, Bishan NPC,1.349917826542603 km
HUA GUAN AVENUE, Clementi NPC,3.073455887263105 km
FERNHILL CLOSE, Bukit Timah NPC,1.6051877805933303 km
JALAN KASAU, Woodlands West NPC,2.8917695689701044 km
LIM TAI SEE WALK, Bukit Timah NPC,2.2385100011524655 km
HAI SING CRESCENT, Hougang NPC,1.3559752129877587 km
CORONATION ROAD WEST, Bukit Timah NPC,2.599581428943804 km
HAIG LANE, Geylang NPC,1.375336803393761 km
WESTLAKE AVENUE, Bishan NPC,1.803373780291068 km
HARVEY CLOSE, Changi NPC,0.49588482635337905 km
LANGSAT ROAD, Geylang NPC,1.6258428661213387 km
RICHARDS PLACE, Hougang NPC,1.5003439568084214 km
COVE DRIVE, Marina Bay NPC,4.400578417888132 km
LILY AVENUE, Bukit Timah NPC,2.123169452472579 km
AROOZOO LANE, Serangoon NPC,1.351417088859529 km
JOO CHIAT AVENUE, Marine Parade NPC,1.1652124633605714 km
ST. FRANCIS ROAD, Toa Payoh NPC,1.8710524376345463 km
HOLLAND GROVE DRIVE, Clementi NPC,1.819063758076622 km
EVERITT ROAD, Geylang NPC,1.8227910254276307 km
SERAYA ROAD, Geylang NPC,1.6025660665621309 km
LEITH PARK, Serangoon NPC,1.1632727273646284 km
JALAN INTAN, Bukit Batok NPC,1.174587679784804 km
FOWLIE ROAD, Marine Parade NPC,1.2490448793651436 km
GAMBIR WALK, Serangoon NPC,0.904345866568957 km
MUGLISTON ROAD, Marine Parade NPC,1.5893763523435094 km
LORONG PAYA LEBAR, Geylang NPC,0.7502748095688957 km
MARLENE AVENUE, Serangoon NPC,0.8613715355460524 km
TOH TUCK DRIVE, Bukit Batok NPC,1.6247013886548025 km
THIRD STREET, Bedok South NPC,1.0857677646400254 km
JALAN WARINGIN, Bedok South NPC,0.26696315181772795 km
LOWLAND ROAD, Hougang NPC,1.449117972694026 km
MOUNT SINAI VIEW, Clementi NPC,1.6840290947416428 km
HIGHLAND ROAD, Serangoon NPC,0.8035519338185763 km
DEDAP ROAD, Ang Mo Kio North NPC,2.4187383755368526 km
LORONG SIGLAP, Bedok South NPC,0.9690584692586515 km
NAMLY PLACE, Bukit Timah NPC,1.4896522254942666 km
GREENBANK PARK, Bukit Batok NPC,3.339575681319772 km
JALAN PERGAM, Changi NPC,0.7336936705555182 km
LAKESHORE VIEW, Marina Bay NPC,3.081044726465958 km
GARDENIA ROAD, Bishan NPC,2.0105274991325413 km
LUCKY HEIGHTS, Bedok North NPC,1.9691818888664994 km
LORONG 30 GEYLANG, Geylang NPC,0.27784104780224306 km
JALAN BAIDURI, Marine Parade NPC,0.6272189684116078 km
HENDRY CLOSE, Serangoon NPC,1.4853035575999536 km
GARLICK AVENUE, Bukit Timah NPC,2.566146680304508 km
AH SOO WALK, Serangoon NPC,1.5313525820848772 km
NIVEN ROAD, Rochor NPC,0.7694527178384662 km
SIRAT ROAD, Serangoon NPC,0.909507319530016 km
SOO CHOW RISE, Bishan NPC,2.0266076033938867 km
LORONG SALLEH, Bedok South NPC,1.4848732660157402 km
JALAN KECHOT, Bedok South NPC,1.5857915755311125 km
JALAN TARI ZAPIN, Sengkang NPC,2.4902627418920096 km
CRANBORNE ROAD, Geylang NPC,0.697973792957811 km
WOODGROVE AVENUE, Woodlands East NPC,1.3637129673812545 km
TOH YI ROAD, Bukit Batok NPC,1.8278523544135854 km
SHREWSBURY ROAD, Kampong Java NPC,0.6993982988771676 km
ZEHNDER ROAD, Queenstown NPC,1.9423757016087944 km
MARTIA ROAD, Marine Parade NPC,0.4747416028623605 km
JALAN HAJI SALAM, Bedok North NPC,2.351421304858228 km
LIMAU GROVE, Bedok North NPC,1.930279049874672 km
POOLE ROAD, Geylang NPC,1.0843310490911053 km
JALAN CHORAK, Serangoon NPC,1.51228416460552 km
LORONG G TELOK KURAU, Marine Parade NPC,1.4896959728663395 km
JALAN BUNGA RAMPAI, Serangoon NPC,2.015594712500828 km
MULBERRY AVENUE, Serangoon NPC,2.384118423078169 km
ELLIOT WALK, Bedok South NPC,1.8376054815615654 km
EATON PLACE, Serangoon NPC,1.0619343865665531 km
JALAN GRISEK, Bedok South NPC,0.4031637002442629 km
JALAN KRIAN, Bedok South NPC,0.5362864830410891 km
KEW HEIGHTS, Bedok North NPC,1.882563032633513 km
KING ALBERT PARK, Clementi NPC,2.4073736928530622 km
SPRINGLEAF ROAD, Marina Bay NPC,0.3082612275117638 km
LIM TUA TOW ROAD, Serangoon NPC,0.7907143965378786 km
GERALD PARK, Hougang NPC,1.6550497281751317 km
ST. PATRICK'S ROAD, Marine Parade NPC,0.24645637428033784 km
CRESCENT ROAD, Geylang NPC,1.6950158091569103 km
ANDREWS TERRACE, Sembawang NPC,2.5110507894410654 km
JALAN LADA PUTEH, Orchard NPC,0.9625899181321222 km
CORONATION WALK, Bukit Timah NPC,0.32105761752302975 km
GREENWOOD PLACE, Bukit Timah NPC,1.3938720016952844 km
JALAN ISNIN, Bishan NPC,1.3228951188998377 km
LORONG J TELOK KURAU, Marine Parade NPC,1.2188263431021054 km
LORONG ABU TALIB, Bedok South NPC,1.3643906701117723 km
MOUNT ROSIE ROAD, Kampong Java NPC,1.46979865484845 km
ROSYTH ROAD, Hougang NPC,1.4685996759771511 km
FIFTH AVENUE, Bukit Timah NPC,2.0095879644807106 km
NAMLY RISE, Bukit Timah NPC,2.116030571798436 km
MANGIS ROAD, Marine Parade NPC,1.5996159877060316 km
SIAN TUAN AVENUE, Clementi NPC,3.0142147138115485 km
BELMONT ROAD, Bukit Timah NPC,1.8632911462983275 km
DEVONSHIRE ROAD, Orchard NPC,0.3302041972034203 km
JALAN SEAVIEW, Geylang NPC,1.4628411023458296 km
JALAN HAJI ALIAS, Bukit Timah NPC,1.7983074772039662 km
PINEWOOD GROVE, Woodlands West NPC,0.5703044451733339 km
BROADRICK CLOSE, Geylang NPC,0.743879873682686 km
LORONG 7 REALTY PARK, Hougang NPC,0.6847132434739845 km
SIXTH AVENUE, Bukit Timah NPC,2.1633121804438304 km
JALAN RABU, Bishan NPC,1.276653356228401 km
EVERITT ROAD NORTH, Geylang NPC,1.8227910254276307 km
MENG SUAN ROAD, Yishun South NPC,2.7349683226685224 km
GREENLEAF PLACE, Clementi NPC,2.303970033979443 km
JALAN CHEGAR, Bishan NPC,1.1227885817427936 km
LINDEN DRIVE, Bukit Timah NPC,1.5410005488391896 km
JALAN CHEMPAKA PUTEH, Bedok North NPC,1.4661564901855777 km
WATTEN CLOSE, Bukit Timah NPC,0.6022403254640685 km
SIOK WAN CLOSE, Queenstown NPC,1.8911491542528047 km
JALAN LENGKOK SEMBAWANG, Yishun North NPC,1.5976584592902299 km
LORONG 14 GEYLANG, Geylang NPC,0.7864850750345217 km
MOUNT SINAI DRIVE, Clementi NPC,1.728138942097285 km
TOH CLOSE, Bukit Batok NPC,1.455123691883588 km
SIMON ROAD, Hougang NPC,1.410281216077529 km
SOO CHOW VIEW, Bishan NPC,2.04713607116436 km
TANAH MERAH BESAR LANE, Pasir Ris NPC,2.0041756432241242 km
CAMBRIDGE ROAD, Kampong Java NPC,0.4902524971850723 km
PULASAN ROAD, Marine Parade NPC,1.158440383657911 km
JALAN KUAK, Bishan NPC,0.8959313377692406 km
PEGU ROAD, Toa Payoh NPC,1.2886928848404615 km
KEW LANE, Bedok North NPC,1.7718340550222293 km
LORONG MYDIN, Bedok South NPC,1.0501347721937189 km
WALTON ROAD, Geylang NPC,1.4148730805417362 km
BO SENG AVENUE, Toa Payoh NPC,1.5702243094880786 km
ANGSANA AVENUE, Serangoon NPC,2.325793918747923 km
KEW WALK, Bedok North NPC,1.8476079444846132 km
JALAN AMPANG, Bukit Timah NPC,1.9201634536759153 km
NALLUR ROAD, Bedok South NPC,1.782889032358803 km
HOW SUN ROAD, Serangoon NPC,1.4330747207402403 km
HIGHLAND CLOSE, Serangoon NPC,1.2003612279881823 km
JALAN KESOMA, Serangoon NPC,1.1314534390428328 km
MATLOCK RISE, Serangoon NPC,0.9971798416919444 km
WOO MON CHEW ROAD, Bedok South NPC,1.53491617714792 km
LICHI AVENUE, Serangoon NPC,2.16239180412774 km
EAST COAST DRIVE, Marine Parade NPC,0.9654359589190918 km
JALAN MACHANG, Sembawang NPC,2.212194905708401 km
WOLSKEL ROAD, Serangoon NPC,0.6501494599813507 km
JALAN SEGAM, Changi NPC,0.6693581913704313 km
PUAY HEE AVENUE, Toa Payoh NPC,2.251774599309028 km
CEDARWOOD GROVE, Woodlands West NPC,0.60777954634761 km
JALAN TAMBUR, Bishan NPC,2.2506223219162313 km
SWISS CLUB LANE, Bukit Timah NPC,2.922704349936239 km
SIMON WALK, Hougang NPC,1.3190023733968328 km
SENNETT TERRACE, Bedok North NPC,1.4466340713876207 km
JALAN WANGI, Serangoon NPC,2.4693369933766767 km
LORONG 101 CHANGI, Geylang NPC,1.646068067608925 km
DUKE'S ROAD, Bukit Timah NPC,1.2108403652454283e-06 km
JALAN KAYU MANIS, Orchard NPC,0.889641075089375 km
JALAN LYE KWEE, Hougang NPC,1.4245758733790297 km
FABER GREEN, Bukit Merah West NPC,0.9768488509019382 km
WISHART ROAD, Bukit Merah West NPC,2.0253061139650477 km
TAN KIM CHENG ROAD, Bukit Timah NPC,0.04227515006900889 km
BRIGHT HILL DRIVE, Bishan NPC,1.7791351082444653 km
LENGKONG LIMA, Bedok South NPC,0.7758598794806351 km
GREENLEAF DRIVE, Clementi NPC,2.0045597096663545 km
JALAN PACHELI, Serangoon NPC,1.0021754696450431 km
JALAN HARI RAYA, Bishan NPC,1.1732209081215816 km
JOO AVENUE, Rochor NPC,0.8480295776083768 km
THIRD AVENUE, Bukit Timah NPC,1.6938433007120937 km
TOH TUCK CLOSE, Bukit Batok NPC,1.455123691883588 km
TELOK KURAU ROAD, Bedok South NPC,1.3759605744342496 km
BEDOK GARDEN, Bedok North NPC,1.4674601320846528 km
LORONG 36 GEYLANG, Geylang NPC,0.4270302814703939 km
DAISY AVENUE, Serangoon NPC,0.8544932866814273 km
KARIKAL LANE, Marine Parade NPC,0.5637757297041704 km
JALAN KEMBOJA, Serangoon NPC,2.415746265594479 km
LENGKONG DUA, Bedok South NPC,0.7263622274199479 km
CHATSWORTH PARK, Bukit Merah West NPC,1.5866697449388176 km
UPPER PAYA LEBAR ROAD, Serangoon NPC,2.4029603047618853 km
BEECHWOOD GROVE, Woodlands West NPC,0.7386145732730931 km
JALAN LANA, Bedok South NPC,0.09132858035250732 km
SWETTENHAM ROAD, Bukit Timah NPC,1.9278839149126072 km
OLIVE ROAD, Toa Payoh NPC,1.6813951960279108 km
GOLDHILL DRIVE, Kampong Java NPC,1.846086648699102 km
EMERALD HILL ROAD, Orchard NPC,0.4962924658037378 km
HILLSIDE TERRACE, Serangoon NPC,0.9867495796025118 km
SUNSET CRESCENT, Clementi NPC,1.253249267081355 km
CABLE ROAD, Bukit Merah West NPC,1.6557329305872455 km
LUCKY VIEW, Bedok North NPC,1.8113660420924582 km
LORONG 6 REALTY PARK, Hougang NPC,0.7523800742970166 km
BEDOK CLOSE, Bedok North NPC,1.605929615355242 km
NAMLY AVENUE, Bukit Timah NPC,1.3681497797921098 km
CASSIA DRIVE, Bukit Timah NPC,1.6371031792552009 km
ST. ANNE'S WOOD, Sengkang NPC,1.0500597698516836 km
JALAN TEMPUA, Bukit Timah NPC,0.8083701909477136 km
WATTEN ESTATE ROAD, Bukit Timah NPC,0.5137663241367992 km
FABER TERRACE, Clementi NPC,1.217859015452601 km
TOH TUCK TERRACE, Bukit Batok NPC,1.5854851992167815 km
MAKEPEACE ROAD, Kampong Java NPC,0.4643743273589947 km
GREENLEAF ROAD, Clementi NPC,2.2845420916352195 km
PONGGOL TWENTY-FOURTH AVENUE, Punggol NPC,2.891592291840159 km
LORONG 107 CHANGI, Marine Parade NPC,1.6589067629792558 km
JALAN TANI, Hougang NPC,0.9357264321623353 km
KEE SUN AVENUE, Marine Parade NPC,1.645217729596145 km
SALLIM ROAD, Geylang NPC,1.8473146093332664 km
HIGHLAND TERRACE, Serangoon NPC,1.2823085861863037 km
JALAN BUMBONG, Woodlands West NPC,2.7309254843696564 km
DEDAP LINK, Ang Mo Kio North NPC,2.480126485030866 km
WATTEN TERRACE, Bukit Timah NPC,0.5778088818177003 km
LILAC ROAD, Ang Mo Kio South NPC,1.7887562896162372 km
WILLOW AVENUE, Serangoon NPC,2.1103393810813498 km
JALAN LEPAS, Serangoon NPC,1.8748963913134633 km
TOH DRIVE, Bukit Batok NPC,2.0789434119063657 km
JALAN RAYA, Bishan NPC,1.1732209081215816 km
JALAN KATHI, Bedok North NPC,2.045260190873845 km
PRIMROSE AVENUE, Bedok North NPC,1.8961251071240628 km
EE TEOW LENG ROAD, Serangoon NPC,0.9958868147589997 km
SENNETT CLOSE, Bedok North NPC,1.824063347167245 km
DALVEY ESTATE, Bukit Timah NPC,1.125911695162801 km
BROADRICK ROAD, Geylang NPC,1.3347242080467565 km
BRIGHTON CRESCENT, Serangoon NPC,1.2225197782993047 km
SOMMERVILLE WALK, Serangoon NPC,0.9601090600587777 km
NAMLY HILL, Bukit Timah NPC,1.522492393582969 km
WILTSHIRE ROAD, Bedok North NPC,1.7176188650180277 km
FERNHILL CRESCENT, Bukit Timah NPC,1.6237571868426084 km
CHANCERY LANE, Kampong Java NPC,1.308528810401021 km
JALAN TERUBOK, Bishan NPC,1.493291377622721 km
TREASURE ISLAND, Marina Bay NPC,2.9056427185528677 km
MACPHERSON ROAD, Toa Payoh NPC,2.4202473650908813 km
ELITE PARK AVENUE, Bedok South NPC,1.0259438956253506 km
AH SOO GARDEN, Serangoon NPC,1.419499837079638 km
RECREATION ROAD, Serangoon NPC,0.39682482163476435 km
JALAN NAGA SARI, Bukit Timah NPC,1.7784894595934084 km
LENGKONG TIGA, Bedok South NPC,1.0162819905250666 km
LORONG HOW SUN, Serangoon NPC,1.497039653818812 km
RAMSGATE ROAD, Geylang NPC,1.3538917111700115 km
JALAN TARI PIRING, Sengkang NPC,2.48837471395142 km
JALAN ELOK, Orchard NPC,0.9063622601452624 km
ASTRID HILL, Bukit Timah NPC,2.2247676473794082 km
OLD HOLLAND ROAD, Bukit Timah NPC,2.7779534051704826 km
JOO CHIAT WALK, Marine Parade NPC,1.0117854085451878 km
JALAN PARAS, Bedok South NPC,0.5604217992979145 km
LORONG 106 CHANGI, Marine Parade NPC,1.676680872520115 km
JOON HIANG ROAD, Serangoon NPC,0.5521943330728656 km
EAST SUSSEX LANE, Bukit Timah NPC,2.603285987780936 km
SOO CHOW DRIVE, Bishan NPC,1.940479843662556 km
JALAN TANJONG, Bedok North NPC,0.7127023095363741 km
VICTORIA PARK CLOSE, Bukit Timah NPC,1.0600601031357613 km
