0,1,2
JALAN LEBAT DAUN, Hougang NPC,2.0967587761267295 km
NERAM ROAD, Ang Mo Kio North NPC,2.271416631255585 km
JALAN SINDOR, Hougang NPC,1.7167467349017613 km
JALAN PERADUN, Hougang NPC,2.041586302279263 km
KASAI ROAD, Hougang NPC,2.2920101525386185 km
JALAN RENGAS, Hougang NPC,1.9216451639244918 km
JALAN KELULUT, Hougang NPC,1.4491311901318205 km
JALAN CHERMAI, Hougang NPC,1.8591398910975816 km
SELETAR CRESCENT, Ang Mo Kio North NPC,2.8143603380881665 km
JALAN JORAN, Hougang NPC,2.0322053488008898 km
JALAN RESAK, Hougang NPC,1.3563791459466672 km
NIM GREEN, Ang Mo Kio South NPC,2.158113632718266 km
SARACA HILL, Ang Mo Kio North NPC,2.1738757550908017 km
JALAN KETUMBIT, Hougang NPC,1.4856428477219676 km
NERAM CRESCENT, Hougang NPC,2.2671286187071504 km
JALAN JITONG, Hougang NPC,1.9868334730825108 km
NIM DRIVE, Ang Mo Kio South NPC,2.254631984855802 km
MIMOSA CRESCENT, Ang Mo Kio South NPC,2.0401583610505036 km
JALAN ANTOI, Hougang NPC,1.6278223918515382 km
JALAN SAJAK, Sembawang NPC,1.2320862147529326 km
JALAN SERENGAM, Sembawang NPC,0.7812589539611928 km
JALAN CHERPEN, Sembawang NPC,1.1836237077658696 km
JALAN SALANG, Sembawang NPC,1.167995636017938 km
JALAN HIKAYAT, Sembawang NPC,1.1181526587867225 km
JALAN SHAER, Sembawang NPC,1.100158048418093 km
JALAN TELIPOK, Sembawang NPC,0.7533761751942397 km
JALAN GAPIS, Sembawang NPC,2.387776273248839 km
JALAN MALU-MALU, Sembawang NPC,0.8948113112528026 km
BROCKHAMPTON DRIVE, Serangoon NPC,1.1778643483606834 km
CARDIFF GROVE, Serangoon NPC,0.9548114730115181 km
HYTHE ROAD, Serangoon NPC,1.6497579299887728 km
CARISBROOKE GROVE, Serangoon NPC,1.1654871996433878 km
WALMER DRIVE, Serangoon NPC,1.3938614148751496 km
JALAN CHULEK, Serangoon NPC,1.5747173918720907 km
WORTHING ROAD, Serangoon NPC,1.6411248433595915 km
CONISTON GROVE, Serangoon NPC,0.9042458110288115 km
SERANGOON GARDEN WAY, Serangoon NPC,1.1427451895726373 km
HUDDINGTON AVENUE, Serangoon NPC,1.6549200897400487 km
CROWHURST DRIVE, Serangoon NPC,1.2560751196319306 km
CHISELHURST GROVE, Serangoon NPC,0.9967106835426348 km
PORTCHESTER AVENUE, Serangoon NPC,1.5839583524545038 km
BRAEMAR DRIVE, Serangoon NPC,1.1899537542324357 km
MEDWAY DRIVE, Serangoon NPC,1.2912730834815136 km
BRIDPORT AVENUE, Ang Mo Kio South NPC,1.570396976590273 km
CORAL ISLAND, Marina Bay NPC,2.582248128144261 km
HEMSLEY AVENUE, Ang Mo Kio South NPC,1.6465534011592984 km
BERWICK DRIVE, Ang Mo Kio South NPC,1.250887475780258 km
BURGHLEY DRIVE, Serangoon NPC,1.3825347757566961 km
ALNWICK ROAD, Serangoon NPC,1.3677923097355942 km
LICHFIELD ROAD, Serangoon NPC,1.2861756353786216 km
COOLING CLOSE, Serangoon NPC,1.10759532600065 km
COWDRAY AVENUE, Serangoon NPC,1.6190998680156028 km
LUDLOW PLACE, Ang Mo Kio South NPC,1.4308011301567105 km
RAGLAN GROVE, Serangoon NPC,1.3370262947386211 km
FARLEIGH AVENUE, Serangoon NPC,1.4896102043402732 km
JALAN HWI YOH, Serangoon NPC,1.3137781172993404 km
PENSHURST PLACE, Serangoon NPC,1.309990936447821 km
KINGSWEAR AVENUE, Ang Mo Kio South NPC,1.6609071335078565 km
CONWAY GROVE, Serangoon NPC,1.0216840132945313 km
COURT ROAD, Orchard NPC,1.6339121249278095 km
BLOXHOME DRIVE, Serangoon NPC,1.2372470085007192 km
CRICHTON CLOSE, Serangoon NPC,0.8767463243441634 km
KENSINGTON PARK ROAD, Serangoon NPC,1.4830101188997766 km
BODMIN DRIVE, Serangoon NPC,1.2189605744119782 km
YORK PLACE, Ang Mo Kio South NPC,1.5180149706118045 km
STOKESAY DRIVE, Serangoon NPC,1.5104048760216973 km
MORETON CLOSE, Serangoon NPC,1.2607030057831885 km
RIPLEY CRESCENT, Serangoon NPC,1.2683028952830995 km
CHEPSTOW CLOSE, Serangoon NPC,1.277806779861146 km
CORFE PLACE, Serangoon NPC,1.4203736535883078 km
PANG SENG ROAD, Serangoon NPC,2.1447570897290094 km
SEA BREEZE WALK, Changi NPC,0.7497879448866208 km
FARRER DRIVE, Bukit Timah NPC,1.0884764390931851 km
SOMMERVILLE ESTATE ROAD, Bukit Timah NPC,1.4812588063485486 km
SEMBAWANG WALK, Sembawang NPC,0.6188185117073594 km
SPRINGLEAF RISE, Yishun South NPC,2.1123976737794967 km
SPRINGLEAF LANE, Yishun South NPC,2.5782638451288906 km
SPRINGLEAF GARDEN, Yishun South NPC,2.4892782012281898 km
SPRINGLEAF DRIVE, Yishun South NPC,2.2014526157103247 km
SPRINGLEAF CRESCENT, Yishun South NPC,2.105022981039844 km
SPRINGLEAF VIEW, Yishun South NPC,2.5567087492058125 km
KISMIS GREEN, Bukit Batok NPC,2.032492310496362 km
KISMIS ROAD, Bukit Batok NPC,1.8278523544135854 km
WEST COAST GROVE, Clementi NPC,1.240116175961676 km
TAI HWAN HEIGHTS, Serangoon NPC,1.3195036825966424 km
TAI HWAN PLACE, Serangoon NPC,1.1821793975292383 km
TAI HWAN WALK, Serangoon NPC,1.1293366928328377 km
TAI HWAN CLOSE, Serangoon NPC,1.2930951996206486 km
TAI HWAN LANE, Serangoon NPC,1.1212552887456915 km
TAI HWAN AVENUE, Serangoon NPC,1.1280379270061496 km
TAI HWAN GROVE, Serangoon NPC,1.3025391859295232 km
TAI YUAN HEIGHTS, Serangoon NPC,0.681514810424129 km
MAS KUNING TERRACE, Clementi NPC,1.0036296933528512 km
GREENWOOD LANE, Bukit Timah NPC,1.74352258142987 km
GREENWOOD TERRACE, Bukit Timah NPC,1.6920898184786044 km
HINDHEDE PLACE, Bukit Batok NPC,1.960401684303624 km
CHEMPAKA KUNING LINK, Bedok North NPC,1.323127103205356 km
LAUREL WOOD AVENUE, Bukit Timah NPC,2.5102029254793594 km
WESTWOOD AVENUE, Nanyang NPC,0.416623742210602 km
ONTARIO AVENUE, Bishan NPC,2.2013567898875563 km
JALAN IKAN MERAH, Bishan NPC,1.5287849079095563 km
JALAN BELIBAS, Bishan NPC,1.4789022907851772 km
SEMBAWANG HILLS DRIVE, Ang Mo Kio North NPC,1.9337004568466774 km
THOMSON HILLS DRIVE, Ang Mo Kio North NPC,1.6057834780107585 km
TOH HEIGHTS, Pasir Ris NPC,1.5867774491838498 km
CHUAN TERRACE, Serangoon NPC,1.2238401604583315 km
SIGLAP VIEW, Bedok South NPC,0.6224040848403803 km
WEST COAST WALK, Clementi NPC,0.9029500068525194 km
WOOLLERTON PARK, Bukit Timah NPC,0.6625366390840175 km
