0,1,2
JALAN POKOK SERUNAI, Bedok North NPC,2.042751619800389 km
JALAN LATEH, Serangoon NPC,0.5940065722190377 km
HOLLAND PARK, Bukit Timah NPC,1.841957418950446 km
LUCKY RISE, Bedok North NPC,1.5849234503389205 km
MING TECK PARK, Clementi NPC,2.4451669066209454 km
JERVOIS ROAD, Bukit Merah West NPC,0.8143505414752698 km
VANDA CRESCENT, Bukit Timah NPC,1.8638522340089416 km
FORD AVENUE, Bukit Timah NPC,2.3188619661302265 km
CHESTNUT CRESCENT, Bukit Panjang NPC,1.8395342453441839 km
CHERRY AVENUE, Bukit Timah NPC,2.379354048019161 km
JALAN BELANGKAS, Geylang NPC,2.327576511620693 km
FABER CRESCENT, Bukit Merah West NPC,0.9152735097428798 km
JALAN NOVENA, Kampong Java NPC,1.2366628104805053 km
LYNDHURST ROAD, Geylang NPC,0.9524246485633333 km
JALAN HOCK CHYE, Hougang NPC,1.6939189280727334 km
GRANGE ROAD, Bukit Merah West NPC,1.5781172597276498 km
PAYA LEBAR PLACE, Serangoon NPC,1.2254631767089825 km
JALAN LANGGAR BEDOK, Bedok North NPC,1.7617210450416683 km
LEITH ROAD, Serangoon NPC,1.0218354455890697 km
FABER WALK, Clementi NPC,1.1932257589771653 km
GREENDALE AVENUE, Bukit Timah NPC,1.140061154311647 km
JALAN SUASA, Bukit Panjang NPC,2.1022378438155664 km
MOONSTONE LANE, Toa Payoh NPC,2.010930870195589 km
BEDOK RIA PLACE, Bedok North NPC,1.7600266651249565 km
FABER DRIVE, Clementi NPC,0.999225083225795 km
JALAN KURNIA, Serangoon NPC,1.5932527172798516 km
EASTWOOD TERRACE, Changi NPC,2.4432672311507426 km
BARBARY WALK, Queenstown NPC,0.3917938817158997 km
KWONG AVENUE, Toa Payoh NPC,2.3285051371711134 km
NAMLY GARDEN, Bukit Timah NPC,1.6250590507785134 km
KINGSMEAD ROAD, Bukit Timah NPC,0.9953276348216449 km
ELIAS ROAD, Pasir Ris NPC,2.1922095588079076 km
LORONG NANGKA, Marine Parade NPC,1.055451042427835 km
GREENLEAF RISE, Clementi NPC,2.5212105420803685 km
LORONG 105 CHANGI, Marine Parade NPC,1.741507334246745 km
DAISY ROAD, Serangoon NPC,0.9178985194311393 km
JALAN KAMPONG CHANTEK, Bukit Timah NPC,2.9633594840468187 km
SAUNDERS ROAD, Orchard NPC,0.4962924658037378 km
LENGKONG EMPAT, Bedok South NPC,0.944348385730698 km
CAMBORNE ROAD, Bukit Timah NPC,0.9124860760955772 km
VICTORIA PARK ROAD, Bukit Timah NPC,1.094297095917231 km
HOW SUN CLOSE, Serangoon NPC,1.4908622982566615 km
HAIG AVENUE, Geylang NPC,1.4529921259181013 km
JALAN JAMAL, Bedok South NPC,1.3409534632501265 km
LORONG 34 GEYLANG, Geylang NPC,0.3702869004679138 km
LORONG 39 GEYLANG, Geylang NPC,0.6830326676945536 km
FABER GROVE, Clementi NPC,1.299821967237103 km
SENNETT DRIVE, Bedok North NPC,1.602902389973493 km
JALAN PELANGI, Bukit Timah NPC,2.223574848520027 km
JALAN GUMILANG, Bukit Batok NPC,1.0309940247852496 km
MARGATE ROAD, Geylang NPC,1.3004984902822252 km
LORONG KEMBANG, Serangoon NPC,2.297452106107403 km
HAPPY AVENUE EAST, Geylang NPC,2.276086844500841 km
MAYFLOWER PLACE, Ang Mo Kio North NPC,1.3967547617191014 km
JALAN PASIRAN, Kampong Java NPC,1.2858453830003986 km
JALAN SEDAP, Geylang NPC,1.5290388617422468 km
BINJAI HILL, Bukit Batok NPC,3.313942080294269 km
LEEDON ROAD, Bukit Timah NPC,2.1075837279694554 km
SOMMERVILLE ROAD, Serangoon NPC,0.8215475146358401 km
JALAN KHAMIS, Bishan NPC,1.2456230086864186 km
JALAN LIMAU PURUT, Bedok North NPC,1.5243965550964929 km
JALAN GELAM, Sembawang NPC,2.382498371045233 km
NASSIM ROAD, Orchard NPC,1.7142248650360086 km
EVELYN ROAD, Kampong Java NPC,0.7523741589420841 km
DALKEITH ROAD, Bukit Timah NPC,1.0559309282777278 km
KIM YAM ROAD, Orchard NPC,0.3979749714002367 km
NEO PEE TECK LANE, Clementi NPC,2.7390267268905166 km
MAPLE AVENUE, Bukit Timah NPC,2.408112603928761 km
BOURNEMOUTH ROAD, Geylang NPC,1.4906068468136535 km
EVERGREEN GARDENS, Bedok South NPC,1.9141087005640975 km
TUDOR CLOSE, Bukit Timah NPC,0.9610893108986052 km
JALAN GOTONG ROYONG, Serangoon NPC,1.706639312135673 km
LENGKOK MERAK, Orchard NPC,1.6568995365275836 km
KOVAN CLOSE, Serangoon NPC,1.3784940975587014 km
SURIN LANE, Serangoon NPC,1.1906185269044125 km
SUNSET GROVE, Clementi NPC,0.8923065684716233 km
JALAN PARI KIKIS, Bedok North NPC,0.6658228119678954 km
RIDLEY PARK, Queenstown NPC,1.663718727078399 km
LORONG STANGEE, Marine Parade NPC,0.8606251030708528 km
BEDOK AVENUE, Bedok North NPC,1.6317747355725047 km
LORONG BIAWAK, Serangoon NPC,0.513133887248887 km
JALAN GENDANG, Bishan NPC,2.2148503536547275 km
WILKINSON ROAD, Geylang NPC,1.4501289740025447 km
HAI SING ROAD, Hougang NPC,1.3427076309892854 km
WATTEN PARK, Bukit Timah NPC,0.8596725021820957 km
JALAN KEMAMAN, Toa Payoh NPC,0.9174771123899023 km
JALAN JAMBU AYER, Bukit Timah NPC,2.990971476662696 km
LORONG M TELOK KURAU, Marine Parade NPC,0.8255841849610613 km
JALAN DEMAK, Changi NPC,0.7760721240697165 km
ST. MICHAEL'S ROAD, Toa Payoh NPC,1.6683345293821257 km
UPPER NERAM ROAD, Ang Mo Kio North NPC,2.271416631255585 km
HARLYN ROAD, Bukit Timah NPC,1.1287269930735446 km
JALAN GIRANG, Serangoon NPC,0.5613640335213796 km
CLOVER AVENUE, Bishan NPC,0.7414669411448869 km
JALAN LOKAM, Serangoon NPC,1.5175365035245425 km
JALAN SANKAM, Sembawang NPC,2.313015362301869 km
SEA BREEZE ROAD, Changi NPC,0.9549975033248755 km
SUNRISE AVENUE, Ang Mo Kio North NPC,1.296445848474313 km
TOH CRESCENT, Bukit Batok NPC,1.3946495010427473 km
INSTITUTION HILL, Orchard NPC,0.4094321114520842 km
CHIN TERRACE, Pasir Ris NPC,1.6992997912722863 km
JALAN NIPAH, Bedok North NPC,1.8665431022766614 km
JALAN KERIS, Marine Parade NPC,0.6256169678611747 km
COVE WAY, Marina Bay NPC,2.9505336607207244 km
OAKWOOD GROVE, Woodlands West NPC,0.7011797983783925 km
FIRST AVENUE, Bedok North NPC,1.3628089520352067 km
PASIR PANJANG HILL, Queenstown NPC,2.1022621505361534 km
ELIZABETH DRIVE, Bukit Batok NPC,1.3453117473603438 km
LORONG 108 CHANGI, Marine Parade NPC,1.642870001633329 km
THOMSON TERRACE, Ang Mo Kio North NPC,1.668231572277776 km
JALAN ULU SIGLAP, Bedok South NPC,1.4678773582502829 km
JALAN TARI SERIMPI, Sengkang NPC,2.437728192999267 km
ELM AVENUE, Bukit Timah NPC,2.615682686810224 km
LEEDON PARK, Bukit Timah NPC,1.865103363246623 km
UPPER BEDOK ROAD, Bedok South NPC,1.0688751281674873 km
JALAN RIMAU, Bedok South NPC,1.6315191950322192 km
SECOND STREET, Bedok South NPC,1.0969917693477833 km
SWETTENHAM CLOSE, Queenstown NPC,1.3842463143822117 km
EAST COAST TERRACE, Bedok North NPC,2.354596846642672 km
JALAN JAMBU BATU, Bukit Timah NPC,3.057389291132211 km
JALAN TENANG, Clementi NPC,2.3629168860148035 km
LORONG PISANG UDANG, Bukit Batok NPC,1.642243005343498 km
DAFFODIL DRIVE, Bishan NPC,2.165940913129931 km
JALAN BERJAYA, Bishan NPC,0.7245628196976313 km
HILLVIEW WAY, Bukit Batok NPC,0.5611454818074384 km
TAY LIAN TECK ROAD, Bedok South NPC,1.592624406791679 km
CHATSWORTH AVENUE, Bukit Merah West NPC,1.8182975976410358 km
JALAN HAJIJAH, Bedok South NPC,2.0315338645193646 km
JALAN MELATI, Geylang NPC,2.014389214727986 km
JALAN BULOH PERINDU, Marine Parade NPC,0.7853917063195928 km
JALAN SAHABAT, Serangoon NPC,1.1933771933114494 km
JALAN BINGKA, Bukit Batok NPC,2.523559362406794 km
LOTUS AVENUE, Bukit Timah NPC,2.247401940290791 km
KERONG LANE, Sembawang NPC,2.6408016336366993 km
JALAN SELANTING, Bukit Batok NPC,1.304536989640163 km
LIM TECK BOO ROAD, Serangoon NPC,1.809443174368206 km
NAMLY DRIVE, Bukit Timah NPC,1.4854618663302244 km
PILLAI ROAD, Serangoon NPC,1.155862618436285 km
JALAN SENTOSA, Bedok South NPC,0.3470685234391095 km
JALAN ISTIMEWA, Clementi NPC,2.342678590433168 km
LUTHERAN ROAD, Bukit Timah NPC,0.2974597320536075 km
LERMIT ROAD, Bukit Timah NPC,1.3674056532801595 km
JALAN SONGKET, Serangoon NPC,1.68753779029697 km
BIN TONG PARK, Bukit Timah NPC,1.7064215759369743 km
JALAN KAYU, Sengkang NPC,2.349800791459962 km
JASMINE ROAD, Bishan NPC,1.9827593960846668 km
GREENLEAF AVENUE, Clementi NPC,2.3127370753943004 km
BUCKLEY ROAD, Kampong Java NPC,0.8814783021327461 km
DUKU PLACE, Marine Parade NPC,1.0195631175944484 km
MARTABAN ROAD, Toa Payoh NPC,1.2028127383877696 km
CHESTNUT TERRACE, Bukit Panjang NPC,2.1736097581105445 km
JALAN KORBAN, Serangoon NPC,1.6911301466784494 km
TRURO ROAD, Kampong Java NPC,0.4513422398359849 km
HOLLAND GROVE LANE, Clementi NPC,1.754608761752112 km
JALAN KUANG, Changi NPC,0.8225602276061327 km
MARYLAND DRIVE, Clementi NPC,2.219976841033649 km
RAMBUTAN ROAD, Marine Parade NPC,1.3288623506030899 km
KENANGA AVENUE, Serangoon NPC,2.2314178124877095 km
PEARL ISLAND, Marina Bay NPC,3.9145207671895665 km
JALAN KELEMPONG, Pasir Ris NPC,1.1581875386832055 km
NAMLY VIEW, Bukit Timah NPC,1.6870080510594112 km
BEGONIA TERRACE, Ang Mo Kio North NPC,1.9490237340972485 km
LEWIS ROAD, Bukit Timah NPC,1.2193753101797231 km
REBECCA ROAD, Bukit Timah NPC,1.2115681328250083 km
ANDREW ROAD, Geylang NPC,1.5918844490787951 km
HAIG ROAD, Geylang NPC,1.1471583830930105 km
DIX ROAD, Serangoon NPC,1.0589432678904915 km
JALAN RINDU, Serangoon NPC,1.085037117409377 km
KOVAN ROAD, Serangoon NPC,0.8775347443790722 km
GALISTAN AVENUE, Bukit Panjang NPC,1.6929237781652897 km
BRIZAY PARK, Clementi NPC,2.6491369115479046 km
LEMON AVENUE, Bukit Timah NPC,2.1255856695637063 km
PARBURY AVENUE, Bedok North NPC,1.971926691531275 km
GALLOP PARK ROAD, Bukit Timah NPC,0.984284902278639 km
JALAN ANGGEREK, Geylang NPC,2.321127790680255 km
CEDAR AVENUE, Serangoon NPC,2.0476134261934336 km
JALAN LABU MERAH, Serangoon NPC,0.7852815877506067 km
WOODSVILLE CLOSE, Toa Payoh NPC,2.0540948409112816 km
BRIGHTON AVENUE, Serangoon NPC,1.1309323233320758 km
JALAN GELEGAR, Choa Chu Kang NPC,2.72291041876564 km
GOLDHILL RISE, Kampong Java NPC,1.7215344561074601 km
CLOVER CLOSE, Bishan NPC,0.9531129792372317 km
SIANG KUANG AVENUE, Toa Payoh NPC,2.254290389451293 km
LORONG BANDANG, Marine Parade NPC,1.0177933784295699 km
HOW SUN AVENUE, Serangoon NPC,1.4196120521895261 km
DALVEY ROAD, Bukit Timah NPC,1.121194406316153 km
CLOVER RISE, Bishan NPC,1.0724246658563896 km
CHATSWORTH ROAD, Bukit Timah NPC,3.332824567634603 km
BEDOK RISE, Bedok North NPC,1.5849234503389205 km
HAPPY AVENUE NORTH, Geylang NPC,2.259705500299121 km
STRATTON PLACE, Hougang NPC,2.0543529700539978 km
HARVEY AVENUE, Changi NPC,0.7875920838043139 km
ROBIN ROAD, Bukit Timah NPC,1.8613301712465251 km
THAM SOONG AVENUE, Bukit Batok NPC,1.9110620092874058 km
WESTRIDGE WALK, Queenstown NPC,1.874702452128997 km
FOO KIM LIN ROAD, Bedok South NPC,1.5558335570602202 km
CHU YEN STREET, Bukit Batok NPC,1.0113832259293165 km
LORNIE WALK, Bukit Timah NPC,2.0236180939304855 km
JUBILEE ROAD, Clementi NPC,1.2995481380951484 km
CHARLTON LANE, Serangoon NPC,1.2808796317533457 km
VANDA DRIVE, Bukit Timah NPC,1.7935651431676711 km
CARLISLE ROAD, Kampong Java NPC,0.35625609141642334 km
GUILLEMARD CRESCENT, Geylang NPC,0.7095453513355158 km
JALAN CHERMAT, Serangoon NPC,0.7268551392653055 km
NAMLY CRESCENT, Bukit Timah NPC,1.7252291315306998 km
HOOT KIAM ROAD, Orchard NPC,1.0954312083815936 km
BEDOK LANE, Bedok North NPC,1.2903550029088093 km
JALAN JENDELA, Choa Chu Kang NPC,2.6261727670020023 km
JALAN PANDAN, Bukit Timah NPC,1.6297695914612673 km
JALAN TENON, Serangoon NPC,1.5897287831031883 km
VANDA ROAD, Bukit Timah NPC,1.8350382944878552 km
GALLOP PARK, Bukit Timah NPC,0.4071782342609929 km
SIGLAP GARDENS, Marine Parade NPC,1.2508898157461472 km
AVON ROAD, Geylang NPC,0.7443296664014413 km
JALAN SIANTAN, Bukit Timah NPC,1.7980204290208348 km
SEMBAWANG PLACE, Sembawang NPC,0.9348050080941726 km
ROBIN CLOSE, Bukit Timah NPC,1.6641382860659841 km
TOH TUCK CRESCENT, Bukit Batok NPC,1.3946495010427473 km
LORONG 16 GEYLANG, Geylang NPC,0.7369400724869702 km
TREVOSE PLACE, Bukit Timah NPC,1.114285904222729 km
JALAN WAJEK, Bukit Batok NPC,2.6666340460036153 km
JALAN TEMBUSU, Marine Parade NPC,1.6240357798400764 km
WATTEN RISE, Bukit Timah NPC,0.9310829633618382 km
WATTEN VIEW, Bukit Timah NPC,0.8089525228206736 km
BELIMBING AVENUE, Serangoon NPC,2.3610298491925343 km
NEIL ROAD, Bukit Merah East NPC,0.5251991719896723 km
MAYFLOWER DRIVE, Ang Mo Kio North NPC,1.4795352766669652 km
OEI TIONG HAM PARK, Bukit Timah NPC,2.38984664321978 km
JALAN SUKACHITA, Serangoon NPC,0.5652586178769164 km
SELETAR GREEN AVENUE, Hougang NPC,1.483528496592969 km
LORONG SELANGAT, Serangoon NPC,0.7992549946553432 km
JALAN TARI DULANG, Sengkang NPC,2.757975662603493 km
JOO CHIAT ROAD, Geylang NPC,1.5167597163106865 km
TOH AVENUE, Pasir Ris NPC,1.7142518805626543 km
BOSCOMBE ROAD, Geylang NPC,1.136700989487671 km
GREENVIEW CRESCENT, Bukit Timah NPC,1.305807964839293 km
SIMON LANE, Hougang NPC,1.3530176997172954 km
MAYFLOWER LANE, Ang Mo Kio South NPC,1.3058229873927598 km
JAGO CLOSE, Marine Parade NPC,0.7762525139619929 km
JALAN MERLIMAU, Kampong Java NPC,1.309766840966386 km
SANDY LANE, Geylang NPC,0.8513252645776407 km
CLUNY PARK, Bukit Timah NPC,0.18443677886233453 km
FOURTH STREET, Bedok South NPC,1.164742002392506 km
JALAN REMIS, Bedok North NPC,1.9736101618932675 km
PROME ROAD, Toa Payoh NPC,1.0447092118228656 km
LORONG 25 GEYLANG, Geylang NPC,0.6758652580893157 km
CORNWALL GARDENS, Bukit Timah NPC,1.7608781485542297 km
COVE GROVE, Marina Bay NPC,4.155632355790596 km
MAYFLOWER ROAD, Ang Mo Kio South NPC,1.2715538109264648 km
SOPHIA ROAD, Rochor NPC,0.9017526520912861 km
LASIA AVENUE, Bukit Timah NPC,2.126405035153198 km
ROBEY CRESCENT, Hougang NPC,0.8869685938114845 km
SUNSET DRIVE, Clementi NPC,0.8572454758533045 km
SEA BREEZE AVENUE, Changi NPC,0.8853039718281712 km
HAIGSVILLE DRIVE, Geylang NPC,1.298215714883541 km
MERAGI TERRACE, Changi NPC,0.6559602521309187 km
LORONG 22 GEYLANG, Geylang NPC,0.9255320221466168 km
JALAN TARI PAYONG, Sengkang NPC,2.5334575024406902 km
CHEOW KENG ROAD, Marine Parade NPC,0.9687243392341472 km
PHOENIX GARDEN, Bukit Panjang NPC,1.9526937687617878 km
CHESTNUT AVENUE, Bukit Panjang NPC,1.8187947899096564 km
TEOW HOCK AVENUE, Hougang NPC,1.4347319831779906 km
MAYFLOWER WAY, Ang Mo Kio South NPC,1.3595766580008493 km
CHAPEL ROAD, Pasir Ris NPC,1.748813279562099 km
MAYFLOWER TERRACE, Ang Mo Kio South NPC,1.3442031116390787 km
JALAN PUNAI, Bedok South NPC,1.648946432717051 km
JALAN HAROM SETANGKAI, Bukit Timah NPC,0.26229688656887057 km
BUKIT TERESA CLOSE, Bukit Merah West NPC,1.0732873087476384 km
JALAN BILAL, Bedok North NPC,2.230176241009205 km
JALAN JAMBU MAWAR, Bukit Timah NPC,3.028761603335448 km
NAROOMA ROAD, Bukit Timah NPC,1.0303143520282918 km
RANGOON LANE, Kampong Java NPC,0.9292052017001746 km
STRATTON DRIVE, Ang Mo Kio South NPC,2.114156280793165 km
HOUGANG AVENUE 1, Serangoon NPC,1.8259905348630454 km
DUKU LANE, Marine Parade NPC,0.966752815811802 km
JALAN SENANDONG, Bukit Timah NPC,2.8719297089489055 km
PHENG GECK AVENUE, Toa Payoh NPC,2.159897158502046 km
JALAN MERAH SAGA, Bukit Timah NPC,1.8963944900577279 km
TOH TUCK PLACE, Bukit Batok NPC,1.3558681215101769 km
KEW TERRACE, Bedok North NPC,1.9464516548762731 km
PALM DRIVE, Bedok South NPC,1.5901727972423059 km
SWISS CLUB ROAD, Bukit Timah NPC,2.711121812056066 km
CARNATION DRIVE, Bishan NPC,2.030372959822304 km
ROSYTH TERRACE, Serangoon NPC,1.3870026365788324 km
STONE AVENUE, Clementi NPC,2.9827562036363844 km
PALM AVENUE, Bedok South NPC,1.6474870339351286 km
WARINGIN WALK, Bedok South NPC,0.21579059942604686 km
JALAN ZAMRUD, Bukit Batok NPC,1.2450313792968917 km
MARINE PARADE, Bedok South NPC,0.9413008122887242 km
LORONG 110 CHANGI, Bedok South NPC,1.263475827398979 km
THOMSON RIDGE, Bishan NPC,1.6637140700636408 km
GLADIOLA DRIVE, Bishan NPC,2.1182025714198778 km
CHANCERY HILL WALK, Kampong Java NPC,1.5282539028024262 km
PLANTATION AVENUE, Serangoon NPC,0.8561106921637569 km
LORONG 104 CHANGI, Marine Parade NPC,1.8065660996577535 km
FABER AVENUE, Clementi NPC,0.9641707726664471 km
ORIOLE CRESCENT, Bukit Timah NPC,1.7668832158540462 km
ENG KONG CRESCENT, Bukit Batok NPC,1.8482189343001763 km
RIDOUT ROAD, Bukit Timah NPC,1.9546227756010017 km
LORONG 24A GEYLANG, Geylang NPC,0.32430004046700045 km
EDEN GROVE, Serangoon NPC,0.9017911798341552 km
THONG SOON ROAD, Yishun South NPC,2.623676274926068 km
STARLIGHT ROAD, Rochor NPC,0.7191870925352416 km
FERNHILL ROAD, Bukit Timah NPC,1.7699766498900158 km
LORONG 4 REALTY PARK, Hougang NPC,0.8027351930640301 km
ENG KONG LANE, Bukit Batok NPC,1.9485442198651275 km
JALAN TUPAI, Orchard NPC,1.2244247630282816 km
JALAN TAMBAN, Marine Parade NPC,0.4269474768785945 km
PEBBLE LANE, Geylang NPC,0.7954543407571569 km
MERINO CRESCENT, Queenstown NPC,0.5912915446179476 km
JALAN REBANA, Bishan NPC,2.2443222206199827 km
GILSTEAD ROAD, Kampong Java NPC,0.9493211826134711 km
JERVOIS HILL, Bukit Merah West NPC,1.2423416167845323 km
EVERGREEN AVENUE, Bedok North NPC,1.92218960436289 km
MARGOLIOUTH ROAD, Bukit Timah NPC,1.5018595493690714 km
SPRINGLEAF HEIGHT, Yishun South NPC,2.163014245617567 km
TEO KIM ENG ROAD, Bedok South NPC,1.4166646103187626 km
ARTHUR ROAD, Geylang NPC,0.6856198572840144 km
LORONG 6 GEYLANG, Geylang NPC,1.053246187087389 km
JALAN KERIA, Bukit Batok NPC,2.8118474371981907 km
JALAN PUTERI JULA JULI, Marine Parade NPC,0.7887455777122463 km
CLUNY ROAD, Bukit Timah NPC,0.8844044921852967 km
LORONG 20 GEYLANG, Geylang NPC,0.5390827451556781 km
LORONG 102 CHANGI, Geylang NPC,1.7540321146192916 km
KAMPONG JAVA ROAD, Kampong Java NPC,0.324081254216863 km
JALAN MERBOK, Bukit Batok NPC,0.7535294236660459 km
JALAN BATALONG EAST, Pasir Ris NPC,1.1400782122116793 km
LORONG PISANG ASAM, Bukit Batok NPC,1.7758524543792338 km
JALAN SEMPADAN, Bedok South NPC,1.517343100252254 km
ROBIN WALK, Bukit Timah NPC,1.6081064484304195 km
CAMDEN PARK, Bukit Timah NPC,0.6081124466477129 km
JALAN TECK KEE, Serangoon NPC,0.8340726922642878 km
CHESTNUT LANE, Bukit Panjang NPC,2.198938191845381 km
WOOLLERTON DRIVE, Bukit Timah NPC,0.6085612068373749 km
LAKME TERRACE, Bedok South NPC,0.9792998608949239 km
JALAN BASONG, Sembawang NPC,2.1012780187969526 km
KERONG WALK, Sembawang NPC,2.671323031755907 km
NAMLY GROVE, Bukit Timah NPC,1.7897779204612965 km
JALAN JANGGUS, Sembawang NPC,2.3730315605301135 km
GUOK AVENUE, Clementi NPC,2.955831518116554 km
JOO HONG ROAD, Hougang NPC,1.1947777691724564 km
SIMS AVENUE, Geylang NPC,0.690003850520044 km
TANAH MERAH KECHIL ROAD, Bedok North NPC,0.9768267089475203 km
JALAN CHEMPAH, Bishan NPC,1.0483126205665918 km
PALM GROVE AVENUE, Serangoon NPC,1.4146788982570264 km
FARRER ROAD, Bukit Timah NPC,0.8092209107120443 km
JALAN MATA AYER, Yishun South NPC,1.5747864785185675 km
MATTAR ROAD, Geylang NPC,1.7072690289713162 km
BUKIT MUGLISTON, Hougang NPC,1.5337047482596955 km
MEYAPPA CHETTIAR ROAD, Toa Payoh NPC,2.044920449189735 km
LORONG 3 GEYLANG, Geylang NPC,1.2901554567967897 km
SALAM WALK, Bedok North NPC,2.0663521661742634 km
STILL ROAD, Marine Parade NPC,0.8491128208481092 km
JALAN SELENDANG DELIMA, Marine Parade NPC,0.7639198662370016 km
KEE CHOE AVENUE, Serangoon NPC,2.431905451353256 km
STEVENS CLOSE, Bukit Timah NPC,1.7159647570065089 km
BUKIT AYER MOLEK, Bukit Batok NPC,3.264857634324814 km
EASTWOOD WALK, Changi NPC,2.414646709084776 km
JALAN SEMERBAK, Toa Payoh NPC,1.8187354293790057 km
LORONG 18 GEYLANG, Geylang NPC,0.5905446004437455 km
JALAN PELEPAH, Queenstown NPC,1.7511798523568998 km
ALLAMANDA GROVE, Bukit Timah NPC,2.050377160370255 km
SEA BREEZE GROVE, Changi NPC,0.8428502047719827 km
JALAN JERMIN, Geylang NPC,2.158891855880192 km
JALAN JELITA, Clementi NPC,2.429267792118656 km
MOUNT SINAI RISE, Clementi NPC,1.5108950111546398 km
HERTFORD ROAD, Kampong Java NPC,0.14652741935285993 km
LUCKY CRESCENT, Bedok North NPC,1.6936877915238768 km
MAYFLOWER AVENUE, Ang Mo Kio North NPC,1.4245673067537379 km
BUKIT TERESA ROAD, Bukit Merah West NPC,1.3042103336629451 km
MOUNT SINAI AVENUE, Clementi NPC,1.752162947623225 km
BLANDFORD DRIVE, Serangoon NPC,1.1714348655812348 km
JALAN LAYANG LAYANG, Bukit Batok NPC,1.212582500281891 km
MUGLISTON GARDENS, Hougang NPC,1.4285907142935919 km
PRINCESS OF WALES ROAD, Bukit Timah NPC,0.4155017616590661 km
FIRST STREET, Marine Parade NPC,1.2429557229688295 km
JALAN MULIA, Serangoon NPC,2.3179577370265334 km
GREENLEAF GROVE, Clementi NPC,2.3303076666053952 km
LIM AH WOO ROAD, Geylang NPC,0.6380476997198059 km
VAUGHAN ROAD, Serangoon NPC,0.5735877687485817 km
JALAN PEMIMPIN, Bishan NPC,0.9354123145808609 km
AMBER ROAD, Geylang NPC,1.9213969518971263 km
ENG NEO AVENUE, Bukit Timah NPC,1.9931707226716915 km
SARKIES ROAD, Kampong Java NPC,1.054529332005197 km
JALAN JINTAN, Orchard NPC,1.0107172519242855 km
WAREHAM ROAD, Geylang NPC,1.0017132474391768 km
KENG CHIN ROAD, Kampong Java NPC,1.8767988759754817 km
NOVENA TERRACE, Kampong Java NPC,1.108361903836411 km
BEE SAN AVENUE, Clementi NPC,3.0280688875589092 km
ROCHALIE DRIVE, Bukit Merah West NPC,1.817280491588201 km
JALAN USAHA, Serangoon NPC,1.5268658371789714 km
GUAN SOON AVENUE, Changi NPC,0.8742919743632699 km
JALAN BATU NILAM, Bukit Batok NPC,1.3533235127664138 km
BUKIT TUNGGAL ROAD, Kampong Java NPC,1.4350979378560222 km
VEERAGOO CLOSE, Serangoon NPC,1.4866481249836458 km
ORCHID DRIVE, Bukit Timah NPC,1.7935651431676711 km
PRINCE OF WALES ROAD, Bukit Timah NPC,0.3895188470597383 km
LORONG 33 GEYLANG, Geylang NPC,0.43958809219580947 km
TOH STREET, Pasir Ris NPC,1.6054950865695807 km
MOUNT ROSIE TERRACE, Kampong Java NPC,1.7443748346187413 km
FOURTH AVENUE, Bukit Timah NPC,1.960513722467086 km
ANDREWS AVENUE, Sembawang NPC,2.4603629344628986 km
JALAN SOTONG, Marine Parade NPC,0.3771145735579964 km
LENGKOK ANGSA, Orchard NPC,1.0914035081415807 km
MERAGI CLOSE, Changi NPC,0.639551320199635 km
JALAN INSAF, Bishan NPC,0.5978476112599914 km
GUILLEMARD LANE, Geylang NPC,0.5821760925336867 km
SUNDRIDGE PARK ROAD, Serangoon NPC,0.9189238555002406 km
JALAN KERAYONG, Sembawang NPC,2.260023472689906 km
GREENLEAF LANE, Clementi NPC,2.3094818881290586 km
BORTHWICK DRIVE, Serangoon NPC,1.2037207631201146 km
BALMEG HILL, Queenstown NPC,2.258375041261392 km
JALAN KAKATUA, Bukit Batok NPC,1.2050709839653084 km
JALAN AZAM, Marine Parade NPC,0.7633645654361138 km
WATTEN DRIVE, Bukit Timah NPC,0.8511805110207412 km
WHITE HOUSE PARK, Bukit Timah NPC,1.2687312529145054 km
WEST COAST VIEW, Clementi NPC,2.458375284068252 km
SING AVENUE, Rochor NPC,0.7504191924544032 km
QUEEN ASTRID PARK, Bukit Timah NPC,2.5057541837663493 km
JANSEN CLOSE, Serangoon NPC,1.1261817241493928 km
DUNMAN LANE, Geylang NPC,0.9954922652950707 km
BOWMONT GARDENS, Marine Parade NPC,0.9647491802913145 km
LORONG 11 GEYLANG, Geylang NPC,1.0528760437394904 km
JALAN DINDING, Choa Chu Kang NPC,2.670671355272115 km
JALAN SOO BEE, Changi NPC,0.9910622649981573 km
JALAN SAMARINDA, Serangoon NPC,1.8339001732504823 km
GOLDHILL VIEW, Kampong Java NPC,1.7739718391576116 km
JALAN BATALONG, Pasir Ris NPC,0.9033617094624192 km
NIM ROAD, Ang Mo Kio South NPC,2.1284697866237896 km
STEVENS DRIVE, Bukit Timah NPC,1.6467031560487917 km
LENTOR CRESCENT, Ang Mo Kio North NPC,1.3267614231853042 km
LENTOR LINK, Ang Mo Kio North NPC,1.287378299807202 km
LENTOR LANE, Ang Mo Kio North NPC,1.0712212333551916 km
LENTOR PLACE, Ang Mo Kio North NPC,1.120200276525259 km
LIMAU TERRACE, Bedok North NPC,1.658518913574346 km
LIMAU RISE, Bedok North NPC,1.6482721979495027 km
PAYA LEBAR WALK, Serangoon NPC,1.1636762481638214 km
LOYANG BESAR CLOSE, Pasir Ris NPC,1.107140109666041 km
LANTANA AVENUE, Bukit Timah NPC,2.1528805621744413 km
JALAN GEMBIRA, Serangoon NPC,2.35171685378442 km
JALAN SETIA, Serangoon NPC,2.272726830993309 km
JALAN KEMAJUAN, Serangoon NPC,2.45352508167303 km
JALAN MESRA, Serangoon NPC,2.41402033988239 km
JALAN HIBORAN, Serangoon NPC,2.434775142117312 km
JALAN MUHIBBAH, Serangoon NPC,2.4284015459221004 km
TUA KONG PLACE, Bedok South NPC,0.8653673384914562 km
JALAN GAHARU, Bukit Batok NPC,2.689013445319862 km
CROUCHER ROAD, Serangoon NPC,1.0025710271037267 km
SEAGULL WALK, Changi NPC,1.0715183453026011 km
ALMOND STREET, Bukit Panjang NPC,1.5234990541614204 km
ALMOND AVENUE, Bukit Panjang NPC,1.5380735001924803 km
JALAN BINCHANG, Bishan NPC,0.7736749332616015 km
BUKIT WAY, Bukit Batok NPC,2.0725110203079384 km
MUGLISTON WALK, Hougang NPC,1.5070296107967291 km
JALAN SAMPURNA, Bukit Timah NPC,2.247185374027167 km
PARADISE ISLAND, Marina Bay NPC,2.7807591383543957 km
POH HUAT DRIVE, Hougang NPC,0.9834897678374058 km
PAVILION CIRCLE, Bukit Batok NPC,2.559631900305658 km
PAVILION VIEW, Bukit Batok NPC,2.3896726917171085 km
PAVILION PLACE, Bukit Batok NPC,2.4573051492344904 km
PAVILION GROVE, Bukit Batok NPC,2.4855706850687698 km
PAVILION RISE, Bukit Batok NPC,2.514669501216501 km
PAVILION GREEN, Bukit Batok NPC,2.3299838345920483 km
PAVILION STREET, Bukit Batok NPC,2.6026772498135236 km
PEAKVILLE TERRACE, Bedok North NPC,0.7839486443976267 km
PEAKVILLE AVENUE, Bedok North NPC,0.8217593428870849 km
PEAKVILLE GROVE, Bedok North NPC,0.8656501505670131 km
JALAN PARI UNAK, Bedok North NPC,0.7001450838642249 km
PEAKVILLE WALK, Bedok North NPC,0.8145912897512452 km
POH HUAT TERRACE, Hougang NPC,1.0371658081998263 km
DUCHESS ROAD, Bukit Timah NPC,0.5053394228337936 km
MUNSHI ABDULLAH WALK, Ang Mo Kio North NPC,1.6037089706411998 km
SUNSET AVENUE, Bukit Timah NPC,1.9072092094708617 km
FERNVALE CLOSE, Sengkang NPC,1.6262398983819257 km
SANDY ISLAND, Marina Bay NPC,3.8245871299042946 km
MERRYN TERRACE, Bukit Timah NPC,1.5260937185913699 km
SIRAT PLACE, Serangoon NPC,0.8906532469860118 km
MERRYN AVENUE, Bukit Timah NPC,1.521829970192252 km
ENG KONG DRIVE, Clementi NPC,1.8092290962738713 km
JALAN KERUING, Hougang NPC,1.7996818355136939 km
JALAN LAKUM, Hougang NPC,1.9160201709813371 km
JALAN LEKUB, Hougang NPC,1.8599391154183897 km
JALAN JARAK, Hougang NPC,1.2984096143327595 km
JALAN BANGAU, Hougang NPC,1.798996140515538 km
JALAN PELAJAU, Hougang NPC,1.9556620512341925 km
SELETAR HILLS DRIVE, Ang Mo Kio South NPC,2.2524196707962036 km
